{
  "$schema": "../../schema/phoneme-timbre.schema.json",
  "version": 1,
  "locale": "en",
  "description": "Built-in phoneme timbre profiles for SoundScript.Timbre offline synthesis.",
  "default": {
    "burstMs": 6,
    "noise": 0.15,
    "brightness": 0.45,
    "formant1Hz": 550,
    "formant2Hz": 1400,
    "formant3Hz": 2400,
    "smoothness": 0.6,
    "nasal": 0.1,
    "openness": 0.5,
    "formantQ": 1.0,
    "frameSmoothing": 0.2,
    "harmonicRolloff": "default"
  },
  "phonemes": [
    {
      "phoneme": "p",
      "burstMs": 14,
      "noise": 0.35,
      "brightness": 0.15,
      "formant1Hz": 200,
      "formant2Hz": 900,
      "openness": 0.1,
      "harmonic1": 0.2,
      "harmonic2": 0.08,
      "harmonic3": 0.03,
      "noisePlosive": 0.5,
      "transientMs": 6,
      "harmonicRolloff": "linear",
      "formantQ": 0.75,
      "frameSmoothing": 0.05
    },
    {
      "phoneme": "t",
      "burstMs": 12,
      "noise": 0.32,
      "brightness": 0.25,
      "formant1Hz": 220,
      "formant2Hz": 1700,
      "openness": 0.15,
      "harmonic1": 0.25,
      "harmonic2": 0.1,
      "noisePlosive": 0.45,
      "transientMs": 6,
      "harmonicRolloff": "linear",
      "formantQ": 0.75,
      "frameSmoothing": 0.05
    },
    {
      "phoneme": "k",
      "burstMs": 11,
      "noise": 0.3,
      "brightness": 0.3,
      "formant1Hz": 240,
      "formant2Hz": 2100,
      "openness": 0.2,
      "harmonic1": 0.22,
      "harmonic2": 0.09,
      "noisePlosive": 0.42,
      "transientMs": 6,
      "harmonicRolloff": "linear",
      "formantQ": 0.75,
      "frameSmoothing": 0.05
    },
    {
      "phoneme": "b",
      "burstMs": 13,
      "noise": 0.34,
      "brightness": 0.12,
      "formant1Hz": 210,
      "formant2Hz": 850,
      "openness": 0.12,
      "harmonic1": 0.35,
      "harmonic2": 0.14,
      "noisePlosive": 0.3,
      "transientMs": 8,
      "harmonicRolloff": "linear",
      "formantQ": 0.8,
      "frameSmoothing": 0.08
    },
    {
      "phoneme": "d",
      "burstMs": 12,
      "noise": 0.31,
      "brightness": 0.22,
      "formant1Hz": 230,
      "formant2Hz": 1600,
      "openness": 0.14,
      "harmonic1": 0.38,
      "harmonic2": 0.15,
      "noisePlosive": 0.28,
      "transientMs": 8,
      "harmonicRolloff": "linear",
      "formantQ": 0.8,
      "frameSmoothing": 0.08
    },
    {
      "phoneme": "g",
      "burstMs": 11,
      "noise": 0.29,
      "brightness": 0.28,
      "formant1Hz": 250,
      "formant2Hz": 2000,
      "openness": 0.18,
      "harmonic1": 0.36,
      "harmonic2": 0.14,
      "noisePlosive": 0.26,
      "transientMs": 8,
      "harmonicRolloff": "linear",
      "formantQ": 0.8,
      "frameSmoothing": 0.08
    },
    {
      "phoneme": "ch",
      "burstMs": 10,
      "noise": 0.45,
      "brightness": 0.55,
      "formant1Hz": 260,
      "formant2Hz": 2200,
      "openness": 0.2,
      "harmonic1": 0.3,
      "harmonic2": 0.13,
      "noisePlosive": 0.28,
      "noiseFricative": 0.25,
      "noiseBandHz": 5500,
      "transientMs": 8,
      "harmonicRolloff": "linear",
      "formantQ": 0.8,
      "frameSmoothing": 0.08
    },
    {
      "phoneme": "m",
      "noise": 0.08,
      "nasal": 0.85,
      "formant1Hz": 280,
      "formant2Hz": 1000,
      "smoothness": 0.85,
      "openness": 0.25,
      "harmonic1": 0.75,
      "harmonic2": 0.5,
      "harmonic3": 0.32,
      "harmonicRolloff": "exponential",
      "formantQ": 1.2,
      "frameSmoothing": 0.3
    },
    {
      "phoneme": "n",
      "noise": 0.1,
      "nasal": 0.8,
      "formant1Hz": 300,
      "formant2Hz": 1400,
      "smoothness": 0.82,
      "openness": 0.3,
      "harmonic1": 0.78,
      "harmonic2": 0.52,
      "harmonic3": 0.34,
      "harmonicRolloff": "exponential",
      "formantQ": 1.2,
      "frameSmoothing": 0.3
    },
    {
      "phoneme": "ng",
      "noise": 0.12,
      "nasal": 0.88,
      "formant1Hz": 320,
      "formant2Hz": 1800,
      "smoothness": 0.8,
      "openness": 0.35,
      "harmonic1": 0.76,
      "harmonic2": 0.5,
      "harmonic3": 0.32,
      "harmonicRolloff": "exponential",
      "formantQ": 1.2,
      "frameSmoothing": 0.3
    },
    {
      "phoneme": "s",
      "burstMs": 4,
      "noise": 0.82,
      "brightness": 0.9,
      "formant1Hz": 180,
      "formant2Hz": 4800,
      "openness": 0.2,
      "harmonic1": 0.15,
      "harmonic2": 0.06,
      "noiseFricative": 0.8,
      "noiseBandHz": 7500,
      "harmonicRolloff": "linear",
      "formantQ": 0.85,
      "frameSmoothing": 0.05
    },
    {
      "phoneme": "sh",
      "burstMs": 4,
      "noise": 0.78,
      "brightness": 0.75,
      "formant1Hz": 200,
      "formant2Hz": 3200,
      "openness": 0.25,
      "harmonic1": 0.18,
      "harmonic2": 0.08,
      "noiseFricative": 0.75,
      "noiseBandHz": 3800,
      "harmonicRolloff": "linear",
      "formantQ": 0.85,
      "frameSmoothing": 0.05
    },
    {
      "phoneme": "th",
      "burstMs": 5,
      "noise": 0.75,
      "brightness": 0.7,
      "formant1Hz": 190,
      "formant2Hz": 3600,
      "openness": 0.22,
      "harmonic1": 0.16,
      "harmonic2": 0.07,
      "noiseFricative": 0.72,
      "noiseBandHz": 6500,
      "harmonicRolloff": "linear",
      "formantQ": 0.85,
      "frameSmoothing": 0.05
    },
    {
      "phoneme": "f",
      "burstMs": 5,
      "noise": 0.72,
      "brightness": 0.65,
      "formant1Hz": 210,
      "formant2Hz": 2800,
      "openness": 0.18,
      "harmonic1": 0.2,
      "harmonic2": 0.08,
      "noiseFricative": 0.68,
      "noiseBandHz": 4500,
      "harmonicRolloff": "linear",
      "formantQ": 0.85,
      "frameSmoothing": 0.05
    },
    {
      "phoneme": "v",
      "burstMs": 5,
      "noise": 0.68,
      "brightness": 0.55,
      "formant1Hz": 220,
      "formant2Hz": 2400,
      "openness": 0.2,
      "harmonic1": 0.25,
      "harmonic2": 0.1,
      "noiseFricative": 0.6,
      "noiseBandHz": 3800,
      "harmonicRolloff": "linear",
      "formantQ": 0.85,
      "frameSmoothing": 0.1
    },
    {
      "phoneme": "z",
      "burstMs": 4,
      "noise": 0.76,
      "brightness": 0.72,
      "formant1Hz": 200,
      "formant2Hz": 4200,
      "openness": 0.22,
      "harmonic1": 0.17,
      "harmonic2": 0.07,
      "noiseFricative": 0.74,
      "noiseBandHz": 7000,
      "harmonicRolloff": "linear",
      "formantQ": 0.85,
      "frameSmoothing": 0.1
    },
    {
      "phoneme": "h",
      "burstMs": 3,
      "noise": 0.55,
      "brightness": 0.5,
      "formant1Hz": 500,
      "formant2Hz": 1500,
      "openness": 0.4,
      "harmonic1": 0.4,
      "harmonic2": 0.18,
      "noiseFricative": 0.45,
      "noiseBandHz": 2500,
      "harmonicRolloff": "linear",
      "formantQ": 0.9,
      "frameSmoothing": 0.1
    },
    {
      "phoneme": "r",
      "noise": 0.18,
      "brightness": 0.55,
      "formant1Hz": 400,
      "formant2Hz": 1200,
      "smoothness": 0.7,
      "openness": 0.45,
      "harmonic1": 0.65,
      "harmonic2": 0.4,
      "harmonic3": 0.24,
      "harmonicRolloff": "exponential",
      "formantQ": 1.1,
      "frameSmoothing": 0.25
    },
    {
      "phoneme": "l",
      "noise": 0.14,
      "brightness": 0.48,
      "formant1Hz": 380,
      "formant2Hz": 1100,
      "smoothness": 0.72,
      "openness": 0.42,
      "harmonic1": 0.68,
      "harmonic2": 0.42,
      "harmonic3": 0.26,
      "harmonicRolloff": "exponential",
      "formantQ": 1.1,
      "frameSmoothing": 0.25
    },
    {
      "phoneme": "w",
      "noise": 0.12,
      "brightness": 0.35,
      "formant1Hz": 300,
      "formant2Hz": 800,
      "smoothness": 0.88,
      "openness": 0.3,
      "harmonic1": 0.72,
      "harmonic2": 0.44,
      "harmonic3": 0.28,
      "harmonicRolloff": "exponential",
      "formantQ": 1.1,
      "frameSmoothing": 0.3
    },
    {
      "phoneme": "j",
      "noise": 0.16,
      "brightness": 0.5,
      "formant1Hz": 320,
      "formant2Hz": 2300,
      "smoothness": 0.8,
      "openness": 0.35,
      "harmonic1": 0.7,
      "harmonic2": 0.46,
      "harmonic3": 0.3,
      "harmonicRolloff": "exponential",
      "formantQ": 1.1,
      "frameSmoothing": 0.25
    },
    {
      "phoneme": "aa",
      "noise": 0.05,
      "brightness": 0.42,
      "formant1Hz": 700,
      "formant2Hz": 1100,
      "smoothness": 0.9,
      "openness": 0.95,
      "harmonic1": 0.72,
      "harmonic2": 0.62,
      "harmonic3": 0.34,
      "noiseFricative": 0.1,
      "noiseBandHz": 6000,
      "transientMs": 4,
      "harmonicRolloff": "exponential",
      "formantQ": 1.4,
      "frameSmoothing": 0.3
    },
    {
      "phoneme": "ee",
      "noise": 0.05,
      "brightness": 0.58,
      "formant1Hz": 280,
      "formant2Hz": 2300,
      "smoothness": 0.88,
      "openness": 0.25,
      "harmonic1": 0.68,
      "harmonic2": 0.58,
      "harmonic3": 0.36,
      "noiseBandHz": 6500,
      "harmonicRolloff": "exponential",
      "formantQ": 1.5,
      "frameSmoothing": 0.3
    },
    {
      "phoneme": "oo",
      "noise": 0.06,
      "brightness": 0.32,
      "formant1Hz": 320,
      "formant2Hz": 800,
      "smoothness": 0.9,
      "openness": 0.3,
      "harmonic1": 0.7,
      "harmonic2": 0.5,
      "harmonic3": 0.26,
      "noiseBandHz": 5000,
      "harmonicRolloff": "exponential",
      "formantQ": 1.6,
      "frameSmoothing": 0.3
    },
    {
      "phoneme": "ai",
      "noise": 0.06,
      "brightness": 0.5,
      "formant1Hz": 650,
      "formant2Hz": 1800,
      "smoothness": 0.86,
      "openness": 0.75,
      "harmonic1": 0.71,
      "harmonic2": 0.6,
      "harmonic3": 0.32,
      "noiseFricative": 0.08,
      "noiseBandHz": 6200,
      "harmonicRolloff": "exponential",
      "formantQ": 1.35,
      "frameSmoothing": 0.28
    },
    {
      "phoneme": "au",
      "noise": 0.06,
      "brightness": 0.45,
      "formant1Hz": 600,
      "formant2Hz": 1000,
      "smoothness": 0.87,
      "openness": 0.8,
      "harmonic1": 0.7,
      "harmonic2": 0.58,
      "harmonic3": 0.3,